title,image_url,permalink,background,ingredients,instructions,tips,remarks
塩麹が決め手！かぼちゃのいとこ煮,nan,https://www.osakafoodstyle.com/recipe/%e5%a1%a9%e9%ba%b9%e3%81%8c%e6%b1%ba%e3%82%81%e6%89%8b%ef%bc%81%e3%81%8b%e3%81%bc%e3%81%a1%e3%82%83%e3%81%ae%e3%81%84%e3%81%a8%e3%81%93%e7%85%ae/,乾燥した小豆はたっぷりの水で戻す必要がなく、思い立った時に作れるヘルシーな一品です。かぼちゃと小豆の優しい甘さが特徴です。,かぼちゃ 1/4個分 / 小豆(乾燥) 200ｇ / 砂糖 大さじ3 / 塩麹 大さじ1/2,"鍋に小豆とひたひたの水を入れて強火にかけ、沸騰したら小豆をザルにあげる。再び鍋に小豆とひたひたの水を加えて強火にかけ、沸騰したら弱火に落とす。20分ほど煮て、軟らかく煮えたことを確認する。
かぼちゃは食べやすい大きさに切り、できれば面取りする。1.の鍋に入れて落し蓋をして煮る。
5分後、砂糖を加えて再び落し蓋をし、3〜5分煮て竹串で刺してかぼちゃの硬さを確認する。竹串が芯まで通ったら、塩麹を加え、全体を大きく混ぜて出来上がり。",小豆の硬さを確認するには、1粒を指でつまんで潰してみてください。潰れたら煮上がりです。,休日にゆっくりコトコトと炊き合わせる、ヘルシーな和のスイーツとしても楽しめます。
絶対に「腹割れ」する英国風スコーン,https://www.osakafoodstyle.com/wp/wp-content/uploads/2020/02/ec84917928c5e5d1550d3cc5db4fdb72.jpg|https://www.osakafoodstyle.com/wp/wp-content/uploads/2020/02/b4f0d57b25f19cbddf9290609d6831da-1.jpg,https://www.osakafoodstyle.com/recipe/scone/,真ん中を割ってクロデットクリームとジャムを挟む、憧れの英国風スコーンのレシピです。ふかふかの食感で、確実に「腹割れ」させるための工程を重視しています。,無塩バター 60g / 薄力粉 160g (a) / 強力粉 100g (a) / ベーキングパウダー 20g (a) / 砂糖 大さじ2 / 牛乳 120cc / 卵 1個(50g),"粉ふるいでaをふるう。バターを1cm角の角切りにする。ボウルにaを入れ、バターを乗せて、冷蔵庫で30分冷やす。
1.のボウルを冷蔵庫から取り出し、砂糖を入れてさっと混ぜる。ボウルの中身を両手で掴んではすり合わせ、掴んではすり合わせを繰り返す。黄色い砂状になればいい。
牛乳と卵をしっかり混ぜ合わせたものを注ぐ。スケッパーで切るように混ぜ、ひとかたまりにする。台(まな板でも良い)に取り出し、表面に薄力粉(分量外)を薄くふるう。スケッパーを生地の上にのせ、上から手でおさえて3cmに伸ばす。半分に切って、一方の生地をもう一方の生地の上に乗せて、再び3cmに伸ばす。また表面の薄力粉を薄くふるい・・・・をあと1回繰り返す。
厚さ3cmにのばし、8等分に四角く切る。180度で温めたオーブンで20分焼く。",薄力粉(分量外)を薄く生地表面全体に均一な量をふるってください。しなくても腹割れする可能性はありますが、粉を薄くふるった方が、腹割れする可能性がぐんと上がります。,
ひな祭りのちらし寿司,https://www.osakafoodstyle.com/wp/wp-content/uploads/2020/03/2da63577192808614012851d1d183238-e1583850148105.jpg|https://www.osakafoodstyle.com/wp/wp-content/uploads/2020/03/2dd805cae154307c0ce3b475607c5a7c-e1583147066866.jpg|https://www.osakafoodstyle.com/wp/wp-content/uploads/2020/03/P3028307.jpg|https://www.osakafoodstyle.com/wp/wp-content/uploads/2020/03/8f81da483961c71af81b3343418c6165-e1583148865683.jpg|https://www.osakafoodstyle.com/wp/wp-content/uploads/2020/03/ac1ba39212847a1c761868caab214cf2-e1583149189558.jpg,https://www.osakafoodstyle.com/recipe/scatteredsushi/,ひな祭りに適した、基本を大切にするシンプルなちらし寿司です。錦糸卵を丁寧に作り、旬の菜の花とたっぷりのニンジンを使用。お魚を使わず「シイタケの甘煮」を味のアクセントにするのが特徴です。,米 2合 / 昆布 5cm / 菜の花 5本 / ニンジン 1/2本 / 【錦糸卵】卵 1個 / 【錦糸卵】水 大さじ2 / 【錦糸卵】塩 小さじ1/4 / 【シイタケの甘煮】シイタケ 大3個(1/2パック・90g) / 【シイタケの甘煮】薄口しょうゆ 大さじ1/2 / 【シイタケの甘煮】砂糖 大さじ1/2 / 【シイタケの甘煮】酒 大さじ1/2 / 【寿司酢(作りやすい分量)】酢 大さじ4 / 【寿司酢】砂糖 大さじ2 / 【寿司酢】塩 小さじ1/2,"米は洗ってざるに上げて水気をきり、炊飯器に入れる(すし飯はふっくら炊き上げる必要がないので、洗ったらすぐに炊く)。少なめの水(360cc)を入れ、昆布をのせて普通に炊く。
鍋に寿司酢の材料を入れ、中火で温める。砂糖が溶けたら火を消す。寿司酢用に60cc(大さじ4)とり、残りは野菜の漬け込み用にする。
ニンジンは千切りにする。菜の花は下の固い部分を切り落とす。鍋に湯を沸かし、ニンジンと菜の花を1分茹でて、ザルに取り出す。水気が切れたら、2で残った寿司酢に浸す。
シイタケは薄切りにする。鍋に調味料とともに入れて、弱火にかける。菜箸で混ぜながら、ほぼ煮汁がなくなるまで煮る。
錦糸卵の全ての材料を混ぜ合わせる。テフロン加工のフライパンにサラダ油を入れ、キッチンペーパーで広げる。フライパンを中火にし、しっかりと温まったら、ぬれぶきん(しぼったものではなく、水に濡れた状態のふきん)にフライパンの底を5秒あてて、冷ます。
再びフライパンを中火に熱し、卵液の1/2量を一気に流し入れたら、手早くフライパンの底を回して全体に広げる。蓋をして、弱めの中火に落として、1分焼く。蓋をあけ、表面が乾いていたら、まな板に取り出す。錦糸卵は片面だけ焼けばOK。残り1枚も同様に焼き、冷めたら千切りにする。
1のご飯をボウルに取り出し、2で取り分けた寿司酢60ccを回し入れて、しゃもじで切るように混ぜる。
4のシイタケの甘煮を5枚、飾り用に取り出す。大皿に寿司飯の1/2を広げ、その上に4の残りのシイタケの甘煮を広げ、残りの寿司飯を重ねるようにのせる。
3のニンジンの汁気をしっかり切り、すし飯の上に広げる。さらに錦糸卵を全体に広げ、3の菜の花、飾り用に取り出したシイタケの甘煮を散らして完成。",錦糸卵を美しく仕上げるには、テフロン加工の効いた良いフライパンを使うのが一番のコツです。裏返し不要の蒸し焼きにすることで失敗を防げます。盛り付けの際、ニンジンが露出しすぎると見た目が強くなりすぎるため、錦糸卵で覆うように隠すと上品に仕上がります。また、錦糸卵を切る際は端の1cm程度を切り落とすと、長さが揃ってプロのような見栄えになります。,余った菜の花はカツオ節と醤油をかけて副菜としてお召し上がりください。お好みでお刺身、イクラ、エビなどをのせるとより豪華なひな祭りのお祝い膳になります。
ミツバと豆腐の熱々あんかけ,https://www.osakafoodstyle.com/wp/wp-content/uploads/2020/03/666fd2e671d047a775b3a5500ce60574.jpg|https://www.osakafoodstyle.com/wp/wp-content/uploads/2020/03/d1c822a5704f35d30d56f0d092fcdbb7.jpg,https://www.osakafoodstyle.com/recipe/mitubatofu/,熱々のあんを生のミツバにかけて仕上げる一品です。ほんのり火が通って食べやすくなるうえ、生でしか味わえない香りとシャキシャキした歯ごたえが楽しめます。,"ミツバ 1束 / 木綿豆腐 1/2丁(150g) / 鶏ひき肉 100g / 酒 大さじ1 / a(薄口しょうゆ・砂糖 各大さじ1, 水100cc, 昆布 3cm) / 水溶き片栗粉(片栗粉 大さじ1, 水 大さじ2)","ミツバは洗って根を切り落とし、4cm幅に切る。木綿豆腐は食べやすい大きさに切る。器に豆腐、みつばの順に盛る。
冷たいフライパンに鶏ひき肉と酒を入れ、弱めの中火にかけ、木べらでほぐしながら、そぼろ状になるまで炒める。aを加え、3分煮込む。
昆布を取り出し、水溶き片栗粉を少しずつ加えてとろみをつけ、火を消す。あんが温かいうちに、器に盛った豆腐とみつばにかければ、できあがり。",熱々のあんをミツバにかけた瞬間、ミツバの香りが立ち上ります。ミツバをしんなりさせて食べやすくするためにも、あんは必ず「熱々」の状態でかけるようにしてください。,ミツバの香りとシャキシャキした食感を最大限に活かしたレシピです。豆腐は木綿豆腐を使用することで、食べ応えのある仕上がりになります。
芽ひじきとニンジンの梅ドレッシングサラダ,https://www.osakafoodstyle.com/wp/wp-content/uploads/2016/06/a9eab422eea3b61ebb98f4254554ccba.jpg,https://www.osakafoodstyle.com/recipe/%e8%8a%bd%e3%81%b2%e3%81%98%e3%81%8d%e3%81%a8%e3%83%8b%e3%83%b3%e3%82%b8%e3%83%b3%e3%81%ae%e6%a2%85%e3%83%89%e3%83%ac%e3%83%83%e3%82%b7%e3%83%b3%e3%82%b0%e3%82%b5%e3%83%a9%e3%83%80/,梅のドレッシングで食欲が沸く、作り置き可能な夏にぴったりの一皿です。,ニンジン 2本(300g) / 芽ひじき(乾) 3g / 油揚げ 1/2枚 / 梅肉 梅ぼし大1個(大さじ1) / オリーブ油 大さじ1 / 酢 大さじ1 / 濃口しょうゆ 小さじ1/2 / 砂糖 小さじ1/2,"ニンジンは千切りに、芽ひじきはたっぷりの水に浸して戻す。油揚げは横半分、縦に1cm幅に切り、フライパンでパリッとなるまで乾炒りする。(フライパンが手間なら、トースターやグリルで焼いても)
芽ひじきは茶こしや細かめのザルにあげて、しっかり水気を切る。ボウルに梅ドレッシングの材料を入れて、しっかり混ぜ合わせたら、ニンジン、芽ひじき、油揚げを入れて和える。",油揚げをフライパンやトースターでパリッとするまで加熱することで、食感のアクセントになります。また、芽ひじきは細かなザルを使い、しっかりと水気を切ることで味がぼやけず仕上がります。,ニンジンの代わりにモヤシ1袋でも代用できます。梅ドレッシングは、冷奴にかけるのもおすすめです。
失敗しない白身魚の煮付け,https://www.osakafoodstyle.com/wp/wp-content/uploads/2020/03/ff3eadea954f22e2c19c27c6c9ee0212.jpg|https://www.osakafoodstyle.com/wp/wp-content/uploads/2020/03/344bbc5a46c803dc8d16f8ff3d813c3b-e1584012687169.jpg,https://www.osakafoodstyle.com/recipe/simmeredwholeseabream/,煮魚でよくある「身が硬くなる」「味が濃すぎる」といった失敗を解消するレシピです。塩麹の酵素を利用することで、魚のタンパク質を分解し、煮込んでも硬くならずふっくらと仕上げることができます。,白身魚(タイやスズキ、サワラなど)の切り身 2切れ / 塩麹 大さじ1/2 / 昆布 3cm / 水 100cc (煮汁) / 酒 大さじ3 (煮汁) / みりん 大さじ3 (煮汁) / 薄口しょうゆ 大さじ1 (煮汁),"鯛は皮目に深さ5mmの切り込みを交差して入れる。表面全体に塩麹を塗り、5分置く。塗った塩麹はぬぐわなくてもいいです。塩分が気になる方はぬぐってください。塩麹を塗って、冷蔵庫保存して、翌日使ってもいいです。より柔らかくなります。
鍋に煮汁と昆布を入れ、中火にかける。沸騰直前に昆布を取り出す。しっかり沸いたら、1.の鯛をいれて弱めの中火にし、落し蓋をして5分煮る。
落とし蓋を外し、魚を器にとる。煮汁を100cc程度になるまで中火にかけて煮詰め、魚にかける。",魚の臭みや表面の滑りを取るための「振り塩＆霜降り」が不要です。塩麹に含まれるプロテアーゼなどの酵素がタンパク質を分解するため、高熱でグラグラ煮ても硬くなりにくく、初心者でも失敗なく作れます。,落し蓋はクッキングシートやアルミホイルで代用できます。
食べるれんこんポタージュ,https://www.osakafoodstyle.com/wp/wp-content/uploads/2020/03/IMG_7027-e1584088247871.jpg|https://www.osakafoodstyle.com/wp/wp-content/uploads/2020/03/2599475596a4c6b87872e36409a3aa85.jpg,https://www.osakafoodstyle.com/recipe/gratedlotusrootsoup/,すりおろしたレンコンを加熱することで生まれる「ぽってり」としたとろみを活かした、和製ポタージュです。エビを効かせた出汁、豆乳、レンコンのトリプルの優しい味が、夏疲れの名残を癒してくれます。食物繊維が豊富で、ごくごく飲むよりも「食べる」ような質感が特徴です。,レンコン 150g / 豆乳 200cc(小1パック) / 薄口しょうゆ 大さじ1 / 飾り用：桜エビ(乾)・パセリのみじん切り 適宜 / 【エビと昆布のだし】昆布 2g / 【エビと昆布のだし】桜エビ(乾) 大さじ1 / 【エビと昆布のだし】水 200cc,"鍋に「エビと昆布のだし」の材料を入れ、強火にかける。沸いたら火を消す。レンコンは皮をむき、飾り用の薄いスライスを8枚作って1分茹でる。(電子レンジ加熱でもよい)残りのレンコンはすりおろし、出汁が入った鍋に入れる。
鍋に薄口しょうゆを入れ、中火にかける。ゴムベラで混ぜながら、レンコンを1分温め、とろみをつける。豆乳を加え、弱火で1〜2分温める。
器に盛り、1.のレンコンスライス、パセリ、桜エビをトッピングしてできあがり。",レンコンは空気に触れると酸化して茶色くなるので、鍋の上におろし金を置いて直接すりおろすと効率的です。豆乳が苦手な方は、牛乳で代用することも可能です。,レンコンは喉の調子を整え、風邪予防に役立ちます。また、豊富に含まれるビタミンCは、紫外線ダメージによる色素沈着を抑える効果が期待できます。消化を助けるためにレンコンをすりおろし、動物性脂肪の牛乳の代わりに豆乳を使用しています。
うすいえんどうのパエリア,https://www.osakafoodstyle.com/wp/wp-content/uploads/2020/03/bdcace4c1dab43b827891413ea28bea3-e1585122570439.jpg|https://www.osakafoodstyle.com/wp/wp-content/uploads/2020/03/IMG_8484-e1585129765256.jpg|https://www.osakafoodstyle.com/wp/wp-content/uploads/2020/03/IMG_8489-e1585129839147.jpg|https://www.osakafoodstyle.com/wp/wp-content/uploads/2020/03/P3248462-e1585191105973.jpg|https://www.osakafoodstyle.com/wp/wp-content/uploads/2020/03/P3248461-e1585191757828.jpg,https://www.osakafoodstyle.com/recipe/beanspaella/,炊飯器不要で、子どもと一緒に豆を取り出す作業から楽しめる時短料理です。うすいえんどうの下茹でが不要なため、豆料理に馴染みがない方でも手軽に作ることができます。,米 200g(1・1/3合) / 昆布 3g / うすいえんどう 30サヤ / ミニトマト 10〜12個 / 新タマネギ 1個(200g) / オリーブ油 適宜 / 塩 小さじ1/2 / カレー粉 小さじ1/2 / 水 250cc / 酒 50cc / 桜海老 大さじ3,"新タマネギはみじん切りにする。うすいえんどうはサヤ8つを飾り用に置いておき、残りは豆をサヤから取り出す。桜海老は酒に浸しておく。火加減を弱目の中火にし、熱したフライパンにオリーブ油大さじ1と新タマネギのみじん切り、塩、カレー粉を入れて、1分炒める。オリーブ油大さじ1を足して、米と豆を入れて、全体を大きく混ぜて油を絡めたら、桜海老と酒を入れる。
米が透き通ってきたら、水を回し入れる。弱火にして、全体を大きく混ぜたら、表面をならして平にする。ミニトマトと飾り用のうすいえんどうを上に散らして、昆布を差して、蓋をする。
20分コトコト炊いて、火を消す。10分置いて蒸らす。食卓にフライパンごと置いて、各々の小皿に取り分けてお召し上がりください。",途中でトマトをつぶして、味をかえてみてください。ボリュームを出したい時は、鶏ひき肉（目安150g。玉ねぎと一緒に炒める）や、皮表面に切り込みを入れたソーセージ（ミニトマトと一緒に飾る）を加えると、より旨味が増します。,野菜を主役に季節をめぐる、野菜づくしの普段のおかず「なにわのおばんざい」レシピです。
丸パン,https://www.osakafoodstyle.com/wp/wp-content/uploads/2020/03/fe075e21353d26d1c8e7995a150fedc2.jpg|https://www.osakafoodstyle.com/wp/wp-content/uploads/2020/03/LINE.jpg|https://www.osakafoodstyle.com/wp/wp-content/uploads/2020/04/P3318537-scaled-e1585905091910.jpg|https://www.osakafoodstyle.com/wp/wp-content/uploads/2020/04/IMG_8619-scaled-e1585905358109.jpg|https://www.osakafoodstyle.com/wp/wp-content/uploads/2020/04/3001-e1589328830873.jpg,https://www.osakafoodstyle.com/recipe/roundbread/,こねる工程をフードプロセッサーにお任せすることで、思い立った時にサッと作れる気軽なパンのレシピです。耐熱容器（フタ付きのガラスボウルなど）を活用して効率よく進めます。,強力粉 200g / ドライイースト 小さじ1 / 砂糖 大さじ1 / 植物油 大さじ1 / 塩 小さじ1/2(または塩麹大さじ1) / 水 150cc,"耐熱容器に水を入れて軽くフタをかぶせ、電子レンジ(1000w)で1分温める。砂糖、ドライイーストを入れて、スプーンでぐるぐる混ぜ、5分置く。(ぷくぷくしてきます。イースト菌が生きている証拠です)
フードプロセッサーの容器に強力粉を入れ、ぷくぷくした状態の1.を入れる。蓋をして10秒攪拌する。塩、油を入れ、さらに10秒攪拌する。生地を取り出し、耐熱容器に入れる。
手を濡らし、耐熱容器のパン生地の端をもちあげて軽く引っ張り、中央に向かって折りたたみ、ぎゅっと押し込む。耐熱容器を45度回し、同様に生地の端を折りたたんでぎゅっと押し込む。これを1周繰り返す。
【一次発酵】フタをして、生地が2倍ほどの大きさになるまで室温に1時間ほど置き、一次発酵をさせる。(オーブンで40度20〜30分発酵させても良い)
【一次発酵の確認】生地が2倍ぐらいに膨らんだら、人差し指に粉（強力粉）をつけて、生地の中央にゆっくり突き刺して、離す。穴が元に戻らず、押した部分がくぼんだままであれば発酵完了。指穴が閉じてしまうようなら発酵不足なので発酵を続け、指穴の周囲にシワができたり生地がつぶれるようなら発酵過多です。
【二次発酵】台に打ち粉をし、容器と生地の間にゴムベラをぐるりと一周差し込んで生地を丁寧に取り出す。グーの手で表面を軽くパンチして空気を抜く。
8等分して、丸めて、天板にのせる。ふんわりラップをかけ、室温に1時間ほど置き、二次発酵をさせる(またはオーブンで40度20分発酵させる)。生地が1.5倍くらいの大きさになれば二次発酵完了。
【焼成】オーブンを200度に予熱し、10〜15分焼く。",一次発酵の見極め（フィンガーテスト）が重要です。穴の状態によって、不足・完了・過多を判断してください。もし発酵し過ぎてしまった場合は、ピザ生地として活用するのがおすすめです。生地を容器から取り出す際は、手で引っ張らずにゴムベラを使用するときれいに離れます。,1次発酵後、動物（トリケラトプスなど）の形に成形して楽しむこともできます。また、二次発酵の際に8等分せず、大きく天板サイズに伸ばせばピザ生地としても利用可能です。
グリル大阪ナスとシラスのボリュームサラダ,https://www.osakafoodstyle.com/wp/wp-content/uploads/2019/05/P5239502-e1557394821987.jpg|https://www.osakafoodstyle.com/wp/wp-content/uploads/2020/04/ad99c6e832a4dd0221079e462eaa96ee-scaled-e1585740583569.jpg|https://www.osakafoodstyle.com/wp/wp-content/uploads/2020/04/1a6ad3c56733fee3a353604320e5b7b2-scaled-e1585742380718.jpg|https://www.osakafoodstyle.com/wp/wp-content/uploads/2020/04/2b58af331ac7655955961fae155fcb43-scaled-e1585742419162.jpg|https://www.osakafoodstyle.com/wp/wp-content/uploads/2020/04/0c5c8ef3a6f53c34457acb3c75aea6de-scaled-e1585742494757.jpg|https://www.osakafoodstyle.com/wp/wp-content/uploads/2020/04/1a069e223ff3f5cd0dbf70d51f931444-scaled-e1585742580688.jpg|https://www.osakafoodstyle.com/wp/wp-content/uploads/2020/04/IMG_8546-scaled-e1585743344100.jpg,https://www.osakafoodstyle.com/recipe/grilledeggplantsalad/,3月下旬から7月頃にかけて旬を迎える「大阪ナス」を主役にしたボリュームのあるサラダです。浸し地に入れたまま作り置きすることで味がよく染み込み、家庭での定番にぴったりの一品です。,ナス 3本 / 釜揚げシラス 50g / レタス 1/2個 / ごま油 大さじ1/2〜1 / 白すりごま 大さじ4 / 酢（浸し地） 大さじ2 / 濃口しょうゆ（浸し地） 大さじ1/2 / 砂糖（浸し地） 大さじ1/2,"ナスは皮目に縦に切り込みを数本入れ(火通りをよくするため)、ヘタをとって縦半分に切る。レタスは4cm角にちぎる(包丁で切った方が見栄えはきれいです)。
魚焼きグリル(またはトースター)に切り口を上にしてナスに入れ、ごま油を表面に塗る。柔らかくなるまで5〜10分焼く。
2.のナスを一口大に切り、容器に入れて浸し地と合わせる(この工程で2日冷蔵保存可)。大皿にレタスを盛り、ナス、ナスの浸し地を回しかけ、シラスとゴマを全体に散らす。",浸し地と合わせた段階で冷蔵庫で2日間保存可能です。時間を置くとより味がなじみます。また、ゴマは乾煎りすることで香りが強くなり、美味しさが引き立ちます。,ごま油なしでも美味しくいただけますが、お好みの油でアレンジも可能です。濃口しょうゆを薄口しょうゆに変更する場合は、塩分のバランスを考えシラスの量を40gに調整してください。
ふきの茎の水煮と蕗味噌,https://www.osakafoodstyle.com/wp/wp-content/uploads/2020/04/b64dbc4a2a46c7538f79e465c6e7bd31-e1586760081606.jpg|https://www.osakafoodstyle.com/wp/wp-content/uploads/2020/04/DSCN9973-e1586760203770.jpg|https://www.osakafoodstyle.com/wp/wp-content/uploads/2020/04/IMG_8412-scaled-e1586845035991.jpg,https://www.osakafoodstyle.com/recipe/boiledbutterburstem/,大阪の春を告げる野菜「ふき」。泉佐野市は一大産地であり、デトックス作用がある健康にも美容にも良い食材です。かつてはタケノコとの含め煮が定番でしたが、現在は下処理の手間から家庭で茹でる方が少なくなっています。季節の味をぜひ家庭で楽しんでください。,ふき 1束 / 塩 大さじ1 / 厚手のビニル袋 1枚 / みそ 大さじ5 / 砂糖 大さじ2.5 / みりん 大さじ2.5 / 油 適量,"ふきは葉と茎を切り分ける（ハサミを使うとよい）。葉は蕗味噌用に取っておき、茎は長さを4等分に切る。
厚手のビニル袋にふきと塩を入れ、軽く口を閉じる。両手で袋をはさみ、ふき全体に塩を刷り込ませる。
直径が一番長いフライパンを用意し、たっぷりの水を入れて沸かす。2.のふきを入れ、2分茹でる。
トングで細い茎から取り出し、太い茎が柔らかくなっていることを確認したら、ザルにあげ、水をはったボウルにさらし、冷やす。
茎を1本持って、端から皮を3cmほどむいていく。バナナの皮をむくように、ぐるりと1周剥けたら、全ての皮をもち、反対側へ引っ張って皮をむく。
【蕗味噌】ふきの葉（1束分）は粗くみじん切りにする。熱したフライパンに油をひき、葉がしんなりするまで炒める。
【蕗味噌】みそ・砂糖・みりんを全て入れ、なめらかになるまで混ぜながら煮詰める。",茹でる際は、家にある中で最も直径の長いフライパンを使うと長い茎も扱いやすくなります。茹で上がりの判断は、太い茎が柔らかくなっているかどうかで確認し、茹ですぎないよう細いものから順に取り出すのがポイントです。皮を剥く時は、最初に端を3cmほど全周剥いてから、まとめて引っ張ると一気に綺麗に剥けます。,下茹でした茎は、お浸しなどの料理に使用してください。すぐに使わない場合は、たっぷりの水に浸した状態で冷蔵保存し、3日以内に使い切りましょう。
